2j4z5rp8,9b5f5119bbfbded3245acc37859cefde967458e7,biorxiv,Containing Emerging Epidemics: a Quantitative Comparison of Quarantine and Symptom Monitoring,10.1101/072652,,,biorxiv,"ABSTRACTStrategies for containing an emerging infectious disease outbreak must be non-pharmaceutical when drugs or vaccines for the pathogen do not yet exist or are unavailable. The success of these non-pharmaceutical strategies will depend not only on the effectiveness of quarantine or other isolation measures but also on the epidemiological characteristics of the infection. However, there is currently no systematic framework to assess the relationship between different containment strategies and the natural history and epidemiological dynamics of the pathogen. Here, we compare the effectiveness of quarantine and symptom monitoring, implemented via contact tracing, in controlling epidemics using an agent-based branching model. We examine the relationship between epidemic containment and the disease dynamics of symptoms and infectiousness for seven case study diseases with diverse natural histories including Ebola, Influenza A, and Severe Acute Respiratory Syndrome (SARS). We show that the comparative effectiveness of symptom monitoring and quarantine depends critically on the natural history of the infectious disease, its inherent transmissibility, and the intervention feasibility in the particular healthcare setting. The benefit of quarantine over symptom monitoring is generally maximized for fast-course diseases, but we show the conditions under which symptom monitoring alone can control certain outbreaks. This quantitative framework can guide policy-makers on how best to use non-pharmaceutical interventions to contain emerging outbreaks and prioritize research during an outbreak of a novel pathogen.SIGNIFICANCEQuarantine and symptom monitoring of contacts with suspected exposure to an infectious disease are key interventions for the control of emerging epidemics; however, there does not yet exist a quantitative framework for comparing the control performance of each. Here, we use a mathematical model of seven case study diseases to show how the choice of intervention is influenced by the natural history of the infectious disease, its inherent transmissibility, and the intervention feasibility in the particular healthcare setting. We use this information to identify the most important characteristics of the disease and setting that need to be characterized for an emerging pathogen in order to make an informed decision between quarantine and symptom monitoring.",2016-08-31,Corey M Peak; Lauren M Childs; Yonatan H Grad; Caroline O Buckee,,,,True,biorxiv_medrxiv,https://doi.org/10.1101/072652
kxe65hd7,,biorxiv,Zika virus infection as a cause of congenital brain abnormalities and Guillain-Barré syndrome: systematic review,10.1101/073098,,,biorxiv,"AbstractBackgroundThe World Health Organization stated in March 2016 that there was scientific consensus that the mosquito-borne Zika virus was a cause of the neurological disorder Guillain-Barré syndrome and of microcephaly and other congenital brain abnormalities, based on rapid evidence assessments. Decisions about causality require systematic assessment to guide public health actions. The objectives of this study were: to update and re-assess the evidence for causality through a rapid and systematic review about links between Zika virus infection and a) congenital brain abnormalities, including microcephaly, in the foetuses and offspring of pregnant women and b) Guillain-Barré syndrome in any population; and to describe the process and outcomes of an expert assessment of the evidence about causality.Methods and findingsThe study had three linked components. First, in February 2016, we developed a causality framework that defined questions about the relationship between Zika virus infection and each of the two clinical outcomes in 10 dimensions; temporality, biological plausibility, strength of association, alternative explanations, cessation, dose-response, animal experiments, analogy, specificity and consistency. Second, we did a systematic review (protocol number CRD42016036693). We searched multiple online sources up to May 30, 2016 to find studies that directly addressed either outcome and any causality dimension, used methods to expedite study selection, data extraction and quality assessment, and summarised evidence descriptively. Third, a multidisciplinary panel of experts assessed the review findings and reached consensus on causality. We found 1091 unique items up to May 30, 2016. For congenital brain abnormalities, including microcephaly, we included 72 items; for eight of 10 causality dimensions (all except dose-response relationship and specificity) we found that more than half the relevant studies supported a causal association with Zika virus infection. For Guillain-Barré syndrome, we included 36 items, of which more than half the relevant studies supported a causal association in seven of ten dimensions (all except dose-response relationship, specificity and animal experimental evidence). Articles identified non-systematically from May 30-July 29, 2016 strengthened the review findings. The expert panel concluded that: a) the most likely explanation of available evidence from outbreaks of Zika virus infection and clusters of microcephaly is that Zika virus infection during pregnancy is a cause of congenital brain abnormalities including 61 microcephaly; and b) the most likely explanation of available evidence from outbreaks of Zika virus infection and Guillain-Barré syndrome is that Zika virus infection is a trigger of Guillain-Barré syndrome. The expert panel recognised that Zika virus alone may not be sufficient to cause either congenital brain abnormalities or Guillain-Barré syndrome but agreed that the evidence was sufficient to recommend increased public health measures. Weaknesses are the limited assessment of the role of dengue virus and other possible co-factors, the small number of comparative epidemiological studies, and the difficulty in keeping the review up to date with the pace of publication of new research.ConclusionsRapid and systematic reviews with frequent updating and open dissemination are now needed, both for appraisal of the evidence about Zika virus infection and for the next public health threats that will emerge. This rapid systematic review found sufficient evidence to say that Zika virus is a cause of congenital abnormalities and is a trigger of Guillain-Barré situation.",2016-09-02,Fabienne Krauer; Maurane Riesen; Ludovic Reveiz; Olufemi T Oladapo; Ruth Martínez-Vega; Teegwendé V. Porgo; Anina Haefliger; Nathalie J Broutet; Nicola Low,,,,False,biorxiv_medrxiv,https://doi.org/10.1101/073098
8elmjre9,8f4b98da50277e6c9516aef0227f5cca9af6b5e8,biorxiv,Identification of quercetin from fruits to immediately fight Zika,10.1101/074559,,,biorxiv,"Zika virus is spread mainly by the bite of an infected mosquito, which can be passed from a pregnant woman to her fetus, thus leading to birth defects including more than microcephaly. It has been recently estimated that one-third of the world population will be infected by Zika in the near future, but unfortunately so far there is no vaccine or medicine for Zika. In particular, the special concern on the vaccine treatment to Zika and Dengue arising from antibody-dependent enhancement strongly emphasizes the key role of its NS2B-NS3 protease (NS2B-NS3pro) as a target for anti-Zika drug discovery/design due to its absolutely-essential role in viral replication. In response to the current global health emergency triggered by the Zika outbreak, we successfully obtained several active forms of Zika NS2B-NS3pro and further attempted to discover its inhibitors from eatable plants and traditional herbal medicines to immediately fight Zika. Here, for the first time, we discovered that quercetin, a flavonoid extensively existing in many fruits and vegetables, effectively inhibits Zika NS2B-NS3pro. We further quantify its inhibitory activity with IC50 of 26 uM; and Ki of 23 uM. As quercetin has been extensively found in fruits, vegetables, leaves and grains, our discovery would benefit the public to immediately fight Zika.",2016-09-11,Amrita Roy; Liangzhong Lim; Jianxing Song,,,,True,biorxiv_medrxiv,https://doi.org/10.1101/074559
l82aakrk,f9b108c052ded463773a9838a8157ac7d5ba6d1a,biorxiv,Unique properties of Zika NS2B-NS3pro complexes as decoded by experiments and MD simulations,10.1101/078113,,,biorxiv,"ABSTRACTZika virus can be passed from a pregnant woman to her fetus, thus leading to birth defects including more than microcephaly. It has been recently estimated that one-third of the world population will be infected by Zika, but unfortunately no vaccine or medicine is available so far. Zika NS2B-NS3pro is essential for its replication and thus represents an attractive target for drug discovery/design. Here we characterized conformation, catalysis, inhibition and dynamics of linked and unlinked Zika NS2B-NS3pro complexes by both experiments and MD simulations. The results unveil the unique properties of Zika NS2B-NS3pro which are very different from Dengue one. Particularly, CD and NMR studies indicate that unlike Dengue, the C-terminal region of Zika NS2B with a significant sequence variation is highly disordered in the open conformation. Indeed, MD simulations reveal that up to 100 ns, the Dengue NS2B C-terminus constantly has close contacts with its NS3pro domain. By a sharp contrast, the Zika NS2B C-terminus loses the contacts with its NS3pro domain after 10 ns, further forming a short β-sheet characteristic of the closed conformation at 30 ns. Furthermore, we found that a small molecule, previously identified as an active site inhibitor for other flaviviral NS2B-NS3pro, inhibited Zika NS2B-NS3pro potently in an allosteric manner. Our study provides the first insight into the dynamics of Zika NS2B-NS3pro and further deciphers that it is susceptible to allosteric inhibition, which thus bears critical implications for the future development of therapeutic allosteric inhibitors.",2016-09-28,Amrita Roy; Liangzhong Lim; Shagun Srivastava; Jianxing Song,,,,True,biorxiv_medrxiv,https://doi.org/10.1101/078113
gfiukh90,5b27a16123f46b5aaeda3171d22e075dcbd36ee6,biorxiv,Identification of a Zika NS2B-NS3pro pocket susceptible to allosteric inhibition by small molecules including qucertin rich in edible plants,10.1101/078543,,,biorxiv,"ABSTRACTIt has been recently estimated that one-third of the world population will be infected by Zika virus, but unfortunately so far there is no vaccine or medicine available. In particular, the special concern on the vaccine treatment to Zika and Dengue arising from antibody-dependent enhancement strongly emphasizes the irreplaceable role of its NS2B-NS3 protease (NS2B-NS3pro) as a target for anti-Zika drug discovery/design due to its absolutely-essential role in viral replication. Very recently we identified two small molecules inhibit Zika NS2B-NS3pro in non-competitive mode, with Ki values of 0.57 and 2.02 µM respective for p-Nitrophenyl-p-guanidino benzoate and qucertin. Here, by molecular docking, we show that although one is designed compound while another is a natural product, both molecules bind to the same pocket on the back of the substrate-binding pocket of Zika NS2B-NS3pro. As the two inhibitors fundamentally differ from cn-716, the only known peptidomimetic boronic acid inhibitor in both structure scaffolds and inhibitory modes, our discovery might open up a new avenue for the future development of allosteric inhibitors, which is highly demanded to achieve therapeutic inhibition of flaviviral NS2B-NS3pro complexes. Furthermore, as qucertin is abundant in many vegetables and fruits such caper, lovage, tea and red onion, our results should benefit the public to immediately fight Zika virus.",2016-10-01,Liangzhong Lim; Amrita Roy; Jianxing Song,,,,True,biorxiv_medrxiv,https://doi.org/10.1101/078543
mkoyc7wh,,biorxiv,Comparative analysis of variation and selection in the HCV genome,10.1101/078584,,,biorxiv,"AbstractGenotype 1 of the hepatitis C virus (HCV) is the most prevalent of the variants of this virus. Its two main subtypes, HCV-1a and HCV-1b, are associated to differences in epidemic features and risk groups, despite sharing similar features in most biological properties. We have analyzed the impact of positive selection on the evolution of these variants using complete genome coding regions, and compared the levels of genetic variability and the distribution of positively selected sites. We have also compared the distributions of positively selected and conserved sites considering different factors such as RNA secondary structure, the presence of different epitopes (antibody, CD4 and CD8), and secondary protein structure. Less than 10% of the genome was found to be under positive selection, and purifying selection was the main evolutionary force in both subtypes. We found differences in the number of positively selected sites between subtypes in several genes (Core, HVR2 in E2, P7, helicase in NS3 and NS4a). Heterozygosity values in positively selected sites and the rate of non-synonymous substitutions were significantly higher in subtype HCV-1b. Logistic regression analyses revealed that similar selective forces act at the genome level in both subtypes: RNA secondary structure and CD4 T-cell epitopes are associated with conservation, while CD8 T-cell epitopes are associated with positive selection in both subtypes. These results indicate that similar selective constraints are acting along HCV-1a and HCV-1b genomes, despite some differences in the distribution of positively selected sites at independent genes.",2016-09-30,Juan Ángel Patiño-Galindo; Fernando González-Candelas,,,,False,biorxiv_medrxiv,https://doi.org/10.1101/078584
lj0ar2v5,28b107243576723248ad4053261000311a22f134,biorxiv,"Genetic, transcriptome, proteomic and epidemiological evidence for blood brain barrier disruption and polymicrobial brain invasion as determinant factors in Alzheimer’s disease",10.1101/080333,,,biorxiv,"AbstractMultiple pathogens have been detected in Alzheimer’s disease (AD) brains. A bioinformatics approach was used to assess relationships between pathogens and AD genes (GWAS), the AD hippocampal transcriptome and plaque or tangle proteins. Host/pathogen interactomes (C.albicans, C.Neoformans, Bornavirus, B.Burgdorferri, cytomegalovirus, Ebola virus, HSV-1, HERV-W, HIV-1, Epstein-Barr, hepatitis C, influenza, C.Pneumoniae, P.Gingivalis, H.Pylori, T.Gondii, T.Cruzi) significantly overlap with misregulated AD hippocampal genes, with plaque and tangle proteins and, except Bornavirus, Ebola and HERV-W, with AD genes. Upregulated AD hippocampal genes match those upregulated by multiple bacteria, viruses, fungi or protozoa in immunocompetent blood cells. AD genes are enriched in bone marrow and immune locations and in GWAS datasets reflecting pathogen diversity, suggesting selection for pathogen resistance. The age of AD patients implies resistance to infections afflicting the younger. APOE4 protects against malaria and hepatitis C, and immune/inflammatory gain of function applies to APOE4, CR1, TREM2 and presenilin variants. 30/78 AD genes are expressed in the blood brain barrier (BBB), which is disrupted by AD risk factors (ageing, alcohol, aluminium, concussion, cerebral hypoperfusion, diabetes, homocysteine, hypercholesterolaemia, hypertension, obesity, pesticides, pollution, physical inactivity, sleep disruption and smoking). The BBB and AD benefit from statins, NSAIDs, oestrogen, melatonin and the Mediterranean diet. Polymicrobial involvement is supported by the upregulation of pathogen sensors/defenders (bacterial, fungal, viral) in the AD brain, blood or CSF. Cerebral pathogen invasion permitted by BBB inadequacy, activating a hyper-efficient immune/inflammatory system, betaamyloid and other antimicrobial defence may be responsible for AD which may respond to antibiotic, antifungal or antiviral therapy.",2016-10-12,C.J. Carter,,,,True,biorxiv_medrxiv,https://doi.org/10.1101/080333
w49x7kca,e6fe63419fe399f9c77513c1c11a043db006a2f3,biorxiv,Accurate prediction of human essential genes using only nucleotide composition and association information,10.1101/084129,,,biorxiv,"AbstractThree groups recently identified essential genes in human cancer cell lines using wet experiments, and these genes are of high values. Herein, we improved the widely used Z curve method by creating a λ-interval Z curve, which considered interval association information. With this method and recursive feature elimination technology, a computational model was developed to predict human gene essentiality. The 5-fold cross-validation test based on our benchmark dataset obtained an area under the receiver operating characteristic curve (AUC) of 0.8814. For the rigorous jackknife test, the AUC score was 0.8854. These results demonstrated that the essentiality of human genes could be reliably reflected by only sequence information. However, previous classifiers in three eukaryotes can gave satisfactory prediction only combining sequence with other features. It is also demonstrated that although the information contributed by interval association is less than adjacent nucleotides, this information can still play an independent role. Integrating the interval information into adjacent ones can significantly improve our classifier’s prediction capacity. We re-predicted the benchmark negative dataset by Pheg server (https://cefg.uestc.edu.cn/Pheg), and 118 genes were additionally predicted as essential. Among them, 21 were found to be homologues in mouse essential genes, indicating that at least a part of the 118 genes were indeed essential, however previous experiments overlooked them. As the first available server, Pheg could predict essentiality for anonymous gene sequences of human. It is also hoped the λ-interval Z curve method could be effectively extended to classification issues of other DNA elements.",2016-10-28,Feng-Biao Biao; Chuan Dong; Hong-Li Hua; Shuo Liu; Hao Luo; Hong-Wan Zhang; Yan-Ting Jin; Kai-Yue Zhang,,,,True,biorxiv_medrxiv,https://doi.org/10.1101/084129
phmm596b,dff716159738acd6bd53b4be12af45358a58752e,biorxiv,MYCOPLASMA FAUCIUM AND BREAST CANCER,10.1101/089128,,,biorxiv,"Viruses and bacteria are the cause of a large number of different human diseases. It is believed that some of them may even contribute to the development of cancer. The present work is dedicated to the identification of mycoplasmas in patients with breast cancer. Mycoplasmas may participate in the development of several human diseases including chronic fatigue syndrome, acquired immunodeficiency syndrome, atypical pneumonia, etc. Moreover, there is a reason to believe that mycoplasma can participate in the development of cancer, leukemia and lymphoma. DNA samples from blood, saliva and tumor tissues of the Oncology Institute of Moldova patients diagnosed with breast cancer were analyzed. Mycoplasma testing was performed using nested PCR method. For Mycoplasma spp. detection, we used primers from the region of the 16S-23S RNA genes. The identification of Mycoplasma faucium, Mycoplasma salivarium and Mycoplasma orale was performed by nested PCR with primers for RNA polymerase beta subunit gene corresponding to mycoplasma. M.faucium and M.salivarius was found in saliva at about 100%, and M.orale at a frequency of about 50%. Only M.faucium was found with the frequency of about 60% in the tissue of the patients. Moreover, a fairly high rate of detection of mycoplasma is observed both in the cases when primers for RNA polymerase gene and primers for 16S-23S RNA were used. We found M.faucium in tumor tissues of patients diagnosed with breast cancer. It is known that mycoplasmas are able to stimulate the synthesis of certain cytokines, which act as mitogenes on the cell. We assume that M.faucium can stimulate the mitogenes synthesis in breast tissues (e.g., cytokines) which, in turn, stimulate cell division and thus participate in the initiation of breast cancer.",2016-11-22,Valentin Mitin; Lidia Tumanova; Natalia Botnariuc,,,,True,biorxiv_medrxiv,https://doi.org/10.1101/089128
iedh762s,8c900409a679dc1f16ef13c73500cbb53605b683,biorxiv,Lung epithelial cells have virus-specific and shared gene expression responses to infection by diverse respiratory viruses,10.1101/090936,,,biorxiv,"AbstractThe severity and outcome of respiratory viral infections is partially determined by the cellular response mounted by infected lung epithelial cells. Disease prevention and treatment is dependent on our understanding of the shared and unique responses elicited by diverse viruses, yet few studies compare host responses to different viruses while controlling other experimental parameters. We compared changes in gene expression of murine lung epithelial cells infected individually by three respiratory viruses causing mild (rhinovirus, RV1B), moderate (coronavirus, MHV-1), and severe (influenza A virus, PR8) disease in mice. RV1B infection caused numerous gene expression changes, but the differential effect peaked at 12 hours post-infection. PR8 altered an intermediate number of genes whose expression continued to change through 24 hours. MHV-1 had comparatively few effects on host gene expression. The viruses elicited highly overlapping responses in antiviral genes, though MHV-1 induced a lower type I interferon response than the other two viruses. Signature genes were identified for each virus and included host defense genes for PR8, tissue remodeling genes for RV1B, and transcription factors for MHV-1. Our comparative approach identified universal and specific transcriptional signatures of virus infection that can be used to discover mechanisms of pathogenesis in the respiratory tract.",2016-12-02,James T. VanLeuven; Benjamin J. Ridenhour; Craig R. Miller; Tanya A. Miura,,,,True,biorxiv_medrxiv,https://doi.org/10.1101/090936
2179jaes,6aa2716c00d89f4b760a9167b15d6203303ae6b9,biorxiv,Vitrification after multiple rounds of sample application and blotting improves particle density on cryo-electron microscopy grids,10.1101/094623,,,biorxiv,"Single particle cryo-electron microscopy (cryoEM) is becoming widely adopted as a tool for structural characterization of biomolecules at near-atomic resolution. Vitrification of the sample to obtain a dense distribution of particles within a single field of view remains a major bottleneck for the success of such experiments. Here, we describe a simple and cost-effective method to increase the density of frozen-hydrated particles on grids with holey carbon support films. It relies on performing multiple rounds of sample application and blotting prior to plunge freezing in liquid ethane. We show that this approach is generally applicable and significantly increases particle density for a range of samples, such as small protein complexes, viruses and filamentous assemblies. The method is versatile, easy to implement, minimizes sample requirements and can enable characterization of samples that would otherwise resist structural studies using single particle cryoEM.",2016-12-15,Joost Snijder; Andrew J. Borst; Annie Dosey; Alexandra C. Walls; Anika Burrell; Vijay S. Reddy; Justin M. Kollman; David Veesler,,,,True,biorxiv_medrxiv,https://doi.org/10.1101/094623
ahdz5078,8eb99586e9103599ab2f58cc33ca94cd0b60ae53,biorxiv,Epidemiological and ecological modelling reveal diversity in upper respiratory tract microbial population structures from a cross-sectional community swabbing study,10.1101/099069,,,biorxiv,"ABSTRACTRespiratory tract infections (RTI) are responsible for over 4 million deaths per year worldwide with pathobiont carriage a required precursor to infection. Through a cross-sectional community-based nasal self-swabbing study we sought to determine carriage epidemiology for respiratory pathogens amongst bacteria (Streptococcus pneumoniae, Haemophilus influenza, Moraxella catarrhalis, Staphylococcus aureus, Pseudomonas aeruginosa and Neisseria meningitidis) and viruses (RSV, Influenza viruses A and B, Rhinovirus/Enterovirus, Coronavirus, Parainfluenza viruses 1-3 and Adenovirus (ADV)). Carriage of bacterial and viral species was shown to vary with participant age, recent RTI and the presence of other species. The spatial structure of microbial respiratory communities was less nested (more disordered) in the young (0-4 years) and those with recent RTI. Species frequency distributions were flatter than random expectation in young individuals (X2 = 20.42, p = 0.002), indicating spatial clumping of species consistent with facilitative relationships amongst them. Deviations from a neutral model of ecological niches were observed for samples collected in the summer and from older individuals (those aged 5-17, 18-64 and ≥65 years) but not in samples collected from winter, younger individuals (those aged 0-4 years), individuals with recent RTI and individuals without recent RTI, demonstrating the importance of both neutral and niche processes in respiratory community assembly. The application of epidemiological methods and ecological theory to sets of respiratory tract samples has yielded novel insights into the factors that drive microbial community composition, such as seasonality and age, as well as species patterns and interactions within the nose.",2017-01-09,Abigail L. Coughtrie; Denise E. Morris; Rebecca Anderson; Nelupha Begum; David W. Cleary; Saul N. Faust; Johanna M. Jefferies; Alex R. Kraaijeveld; Michael V. Moore; Mark A. Mullee; Paul J. Roderick; Andrew Tuck; Robert N. Whittaker; Ho Ming Yuen; C. Patrick Doncaster; Stuart C. Clarke,,,,True,biorxiv_medrxiv,https://doi.org/10.1101/099069
