jhwjh12k,7a51b191fd6575831585eee67a0ac67f209d8fcb,biorxiv,Nuclease escape elements protect messenger RNA against cleavage by multiple viral endonucleases,10.1101/155457,,,biorxiv,"ABSTRACTDuring lytic Kaposi’s sarcoma-associated herpesvirus (KSHV) infection, the viral endonu-clease SOX promotes widespread degradation of cytoplasmic messenger RNA (mRNA). However, select mRNAs, including the transcript encoding interleukin-6 (IL-6), escape SOX-induced cleavage. IL-6 escape is mediated through a 3’ UTR RNA regulatory element that overrides the SOX targeting mechanism. Here, we reveal that this protective RNA element functions to broadly restrict cleavage by a range of homologous and non-homologous viral endonucleases. However, it does not impede cleavage by cellular endonucleases. The IL-6 protective sequence may be representative of a larger class of nuclease escape elements, as we identified a similar protective element in the GADD45B mRNA. The IL-6 and GADD45B-derived elements display similarities in their sequence, putative structure, and several associated RNA binding proteins. However, the overall composition of their ribonucleoprotein complexes appears distinct, leading to differences in the breadth of nucleases restricted. These findings highlight how RNA elements can selectively control transcript abundance in the background of widespread virus-induced mRNA degradation.AUTHOR SUMMARYThe ability of viruses to control the host gene expression environment is crucial to promote viral infection. Many viruses express factors that reduce host gene expression through widespread mRNA decay. However, some mRNAs escape this fate, like the transcript encoding the immunoregulatory cytokine IL-6 during KSHV infection. IL-6 escape relies on an RNA regulatory element located in its 3’UTR and involves the recruitment of a protective protein complex. Here, we show that this escape extends beyond KSHV to a variety of related and unrelated viral endonucleases. However, the IL-6 element does not protect against cellular endonucleases, revealing for the first time a virus-specific nuclease escape element. We identified a related escape element in the GADD45B mRNA, which displays several similarities with the IL-6 element. However, these elements assemble a largely distinct complex of proteins, leading to differences in the breadth of their protective capacity. Collectively, these findings reveal how a putative new class of RNA elements function to control RNA fate in the background of widespread mRNA degradation by viral endonucleases.",2017-06-26,Mandy Muller; Britt A. Glaunsinger,,,,True,biorxiv_medrxiv,https://doi.org/10.1101/155457
h89scli5,b5161b031c7f720562e94735a018d1c3c8be3ae5,biorxiv,Quantifying the Risk and Cost of Active Monitoring for Infectious Diseases,10.1101/156497,,,biorxiv,"AbstractDuring outbreaks of deadly emerging pathogens (e.g., Ebola, MERS-CoV) and bioterror threats (e.g., smallpox), actively monitoring potentially infected individuals aims to limit disease transmission and morbidity. Guidance issued by CDC on active monitoring was a cornerstone of its response to the West Africa Ebola outbreak. There are limited data on how to balance the costs and performance of this important public health activity. We present a framework that estimates the risks and costs of specific durations of active monitoring for pathogens of significant public health concern. We analyze data from New York City’s Ebola active monitoring program over a 16-month period in 2014-2016. For monitored individuals, we identified unique durations of active monitoring that minimize expected costs for those at “low (but not zero) risk” and “some or high risk”: 21 and 31 days, respectively. Extending our analysis to smallpox and MERS-CoV, we found that the optimal length of active monitoring relative to the median incubation period was reduced compared to Ebola due to less variable incubation periods. Active monitoring can save lives but is expensive. Resources can be most effectively allocated by using exposure-risk categories to modify the duration or intensity of active monitoring.",2017-06-28,Nicholas G Reich; Justin Lessler; Jay K Varma; Neil M Vora,,,,True,biorxiv_medrxiv,https://doi.org/10.1101/156497
iisqysqm,138d4617f4f4984bec9cf2c7540fed533d9e4d6e,biorxiv,Automated collection of pathogen-specific diagnostic data for real-time syndromic epidemiological studies,10.1101/157156,,,biorxiv,"AbstractHealth-care and public health professionals rely on accurate, real-time monitoring of infectious diseases for outbreak preparedness and response. Early detection of outbreaks is improved by systems that are pathogen-specific. We describe a system, FilmArray® Trend, for rapid disease reporting that is syndrome-based but pathogen-specific. Results from a multiplex molecular diagnostic test are sent directly to a cloud database. www.syndromictrends.com presents these data in near real-time. Trend preserves patient privacy by removing or obfuscating patient identifiers. We summarize the respiratory pathogen results, for 20 organisms from 344,000 patient samples acquired as standard of care testing over the last four years from 20 clinical laboratories in the United States. The majority of pathogens show influenza-like seasonality, rhinovirus has fall and spring peaks and adenovirus and bacterial pathogens show constant detection over the year. Interestingly, the rate of pathogen co-detections, on average 7.7%, matches predictions based on the relative abundance of organisms present.",2017-07-31,Lindsay Meyers; Christine C. Ginocchio; Aimie N. Faucett; Frederick S. Nolte; Per H. Gesteland; Amy Leber; Diane Janowiak; Virginia Donovan; Jennifer Dien Bard; Silvia Spitzer; Kathleen A. Stellrecht; Hossein Salimnia; Rangaraj Selvarangan; Stefan Juretschko; Judy A. Daly; Jeremy C. Wallentine; Kristy Lindsey; Franklin Moore; Sharon L. Reed; Maria Aguero-Rosenfeld; Paul D. Fey; Gregory A. Storch; Steve J. Melnick; Christine C. Robinson; Jennifer F. Meredith; Camille V. Cook; Robert K. Nelson; Jay D. Jones; Samuel V. Scarpino; Benjamin M. Althouse; Kirk M. Ririe; Bradley A. Malin; Mark A. Poritz,,,,True,biorxiv_medrxiv,https://doi.org/10.1101/157156
j5gjipdn,,biorxiv,Self-assembled Star-shaped Chiroplasmonic Gold Nanoparticles for Ultrasensitive Chiro-immunosensor of Viruses,10.1101/162412,,,biorxiv,"Near field optics and optical tunneling light-matter interaction in the superstructure of chiral nanostructures and semiconductor quantum dots exhibit strong optical rotation activity that may open a new window for chiral-based bioanalytes detection. Herein we report an ultrasensitive, chiro-immunosensor using superstructure of chiral gold nanohybrids (CAu NPs) and quantum dots (QDs). Self-assembling techniques were employed to create asymmetric plasmonic chiral nanostructures for extending the spectral range of circular dichroism (CD) response for obtaining superior plasmonic resonant coupling with the QDs excitonic state; this may help to achieve lower the limit of detection (LOD) values. As a result, the designed probe exhibited avian influenza A (H5N1) viral concentration at picomolar level, a significant improvement in sensitivity in comparison to a non-assembled CAu NPs based chiroassay. The practicability of the proposed sensing system was successfully demonstrated on several virus cultures including, avian influenza A (H4N6) virus, fowl adenovirus and coronavirus in blood samples. The results of our study highlights that exciton-plasmon interaction changes chirality and the self-assembled nanostructures are an efficient strategy for enhancing the sensitivity of plasmonic nanosensors.",2017-07-12,Syed Rahin Ahmed; Éva Nagy; Suresh Neethirajan,,,,False,biorxiv_medrxiv,https://doi.org/10.1101/162412
jzzhpw7h,3b22eecad8a582436c52284a4db2198a98a94e18,biorxiv,"DUSP1 regulates apoptosis and cell migration, but not the JIP1-protected cytokine response, during Respiratory Syncytial Virus and Sendai Virus infection",10.1101/163360,,,biorxiv,"AbstractThe host antiviral response involves the induction of interferons and proinflammatory cytokines, but also the activation of cell death pathways, including apoptosis, to limit viral replication and spreading. This host defense is strictly regulated to eliminate the infection while limiting tissue damage that is associated with virus pathogenesis. Post-translational modifications, most notably phosphorylation, are key regulators of the antiviral defense implying an important role of protein phosphatases. Here, we investigated the role of the dual-specificity phosphatase 1 (DUSP1) in the host defense against human respiratory syncytial virus (RSV), a pathogenic virus of the Pneumoviridae family, and Sendai virus (SeV), a model virus being developed as a vector for anti-RSV vaccine. We found that DUSP1 is upregulated before being subjected to proteasomal degradation. DUSP1 does not inhibit the antiviral response, but negatively regulates virus-induced JNK/p38 MAPK phosphorylation. Interaction with the JNK-interacting protein 1 scaffold protein prevents dephosphorylation of JNK by DUSP1, likely explaining that AP-1 activation and downstream cytokine production are protected from DUSP1 inhibition. Importantly, DUSP1 promotes SeV-induced apoptosis and suppresses cell migration in RSV-infected cells. Collectively, our data unveil a previously unrecognized selective role of DUSP1 in the regulation of tissue damage and repair during infections by RSV and SeV.",2017-07-13,Alexa C. Robitaille; Elise Caron; Nicolas Zucchini; Espérance Mukawera; Damien Adam; Mélissa K. Mariani; Anaïs Gélinas; Audray Fortin; Emmanuelle Brochiero; Nathalie Grandvaux,,,,True,biorxiv_medrxiv,https://doi.org/10.1101/163360
yqa7ggqg,5d9e490190986584d799e2828c6fd9679e5ae159,biorxiv,The IFN response in bat cells consists of canonical and non-canonical ISGs with unique temporal expression kinetics,10.1101/167999,,,biorxiv,"AbstractBats are reservoirs for a number of highly pathogenic zoonotic viruses, yet they remain relatively asymptomatic during infection. Whether this viral resistance is due to a unique innate immune system is unknown. An evolutionarily conserved feature of vertebrate antiviral immunity is the interferon (IFN) response, which triggers cellular defenses through interferon-stimulated gene (ISG) expression. While bats encode an intact IFN system, global ISG expression patterns in bat cells are not well characterized. Here, we used RNA-Seq to assess the transcriptional response to IFNα in cells derived from the bat Pteropus alecto (black flying fox). We show induction of more than 100 transcripts, most of which are canonical ISGs observed in other species. Kinetic gene profiling revealed that P. alecto ISGs fall into two unique temporal subclusters with similar early induction kinetics but distinct late-phase declines. In contrast to bat ISGs, human ISGs generally remained elevated for longer periods following IFN treatment, suggesting host-based differences in gene regulatory mechanisms. Notably, we also identified a small group of non-canonical bat ISGs, including an enzymatically active RNASEL that plays a role in controlling viral infection. These studies provide insight into the innate immune response of an important viral reservoir and lay a foundation for studies into the immunological features that may underlie unique virus-host relationship in bats.Significance StatementBats are considered unique in their ability to resist disease caused by viruses that are often pathogenic in humans. While the nature of this viral resistance is unknown, genomic data suggest bat innate immune systems may be specialized in controlling these disease-causing viruses. A critical cell intrinsic antiviral defense system in vertebrates is the interferon response, which suppresses viral infection through induction of hundreds of interferon-stimulated genes (ISGs). In this study, we report the repertoire of ISGs and several unique features of ISG induction kinetics in bat cells. We also characterize induction and antiviral activity of bat RNASEL, which is induced by IFN in bat, but not human cells. These studies lay the foundation for discovery of potentially new antiviral mechanisms in bats, which may spur research into development of therapies to combat viral infection.",2017-07-24,Pamela C. De La Cruz-Rivera; Mohammed Kanchwala; Hanquan Liang; Ashwani Kumar; Lin-Fa Wang; Chao Xing; John W. Schoggins,,,,True,biorxiv_medrxiv,https://doi.org/10.1101/167999
8xcplab3,fb7371ad31cd501854660876a282060402082537,biorxiv,MERS-CoV spillover at the camel-human interface,10.1101/173211,,,biorxiv,"AbstractMiddle East respiratory syndrome coronavirus (MERS-CoV) is a zoonotic virus from camels causing significant mortality and morbidity in humans in the Arabian Peninsula. The epidemiology of the virus remains poorly understood, and while case-based and seroepidemiological studies have been employed extensively throughout the epidemic, viral sequence data have not been utilised to their full potential. Here we use existing MERS-CoV sequence data to explore its phylodynamics in two of its known major hosts, humans and camels. We employ structured coalescent models to show that long-term MERS-CoV evolution occurs exclusively in camels, whereas humans act as a transient, and ultimately terminal host. By analysing the distribution of human outbreak cluster sizes and zoonotic introduction times we show that human outbreaks in the Arabian peninsula are driven by seasonally varying zoonotic transfer of viruses from camels. Without heretofore unseen evolution of host tropism, MERS-CoV is unlikely to become endemic in humans.",2017-08-10,Gytis Dudas; Luiz Max Carvalho; Andrew Rambaut; Trevor Bedford; Ali M. Somily; Mazin Barry; Sarah S. Al Subaie; Abdulaziz A. BinSaeed; Fahad A. Alzamil; Waleed Zaher; Theeb Al Qahtani; Khaldoon Al Jerian; Scott J.N. McNabb; Imad A. Al-Jahdali; Ahmed M. Alotaibi; Nahid A. Batarfi; Matthew Cotten; Simon J. Watson; Spela Binter; Paul Kellam,,,,True,biorxiv_medrxiv,https://doi.org/10.1101/173211
v7asfaxc,656ef218f7dcea5555a59cdc29d0f9ec8d5c2a82,biorxiv,MERS-CoV NSP16 necessary for IFN resistance and viral pathogenesis,10.1101/173286,,,biorxiv,"AbstractCoronaviruses encode a mix of highly conserved and novel genes as well as genetic elements necessary for infection and pathogenesis, raising the possibility for common targets for attenuation and therapeutic design. In this study, we focus on the highly conserved nonstructural protein (NSP) 16, a viral 2’O methyl-transferase (MTase) that encodes critical functions in immune modulation and infection. Using reverse genetics, we disrupted a key motif in the conserved KDKE motif of MERS NSP16 (D130A) and evaluated the effect on viral infection and pathogenesis. While the absence of 2’O MTase activity had only marginal impact on propagation and replication in Vero cells, the MERS dNSP16 mutant demonstrated significant attenuation relative to control both in primary human airway cultures and in vivo. Further examination indicated the MERS dNSP16 mutant had a type I IFN based attenuation and was partially restored in the absence of IFIT molecules. Importantly, the robust attenuation permitted use of MERS dNSP16 as a live attenuated vaccine platform protecting from challenge with a mouse adapted MERS-CoV strain. These studies demonstrate the importance of the conserved 2’O MTase activity for CoV pathogenesis and highlight NSP16 as a conserved universal target for rapid live attenuated vaccine design in an expanding CoV outbreak setting.SignificanceCoronavirus emergence in both human and livestock represents a significant threat to global public health, as evidenced by the sudden emergence of SARS-CoV, MERS-CoV, PEDV and swine delta coronavirus in the 21st century. These studies describe an approach that effectively targets the highly conserved 2’O methyl-transferase activity of coronaviruses for attenuation. With clear understanding of the IFN/IFIT based mechanism, NSP16 mutants provide a suitable target for a live attenuated vaccine platform as well as therapeutic development for both current and future emergent CoV strains. Importantly, other approaches targeting other conserved pan-coronavirus functions have not yet proven effective against MERS-CoV, illustrating the broad applicability of targeting viral 2’O MTase function across coronaviruses.",2017-08-08,Vineet D. Menachery; Lisa E. Gralinski; Hugh D. Mitchell; Kenneth H. Dinnon; Sarah R. Leist; Boyd L. Yount; Rachel L. Graham; Eileen T. McAnarney; Kelly G. Stratton; Adam S. Cockrell; Kari Debbink; Amy C. Sims; Katrina M. Waters; Ralph S. Baric,,,,True,biorxiv_medrxiv,https://doi.org/10.1101/173286
vqtx98xm,f126b7f9c8ba02a0f872b51cf95d08086e0bd4ac,biorxiv,Proofreading-deficient coronaviruses adapt over long-term passage for increased fidelity and fitness without reversion of exoribonuclease-inactivating mutations,10.1101/175562,,,biorxiv,"ABSTRACTThe coronavirus (CoV) RNA genome is the largest among single-stranded positive sense RNA viruses. CoVs encode a proofreading 3′→5′exoribonuclease within nonstructural protein 14 (nsp14-ExoN) that is responsible for CoV high-fidelity replication. Alanine substitution of ExoN catalytic residues [ExoN(-)] in SARS-CoV and murine hepatitis virus (MHV) disrupts ExoN activity, yielding viable mutant viruses with defective replication, up to 20-fold decreased fidelity, and increased susceptibility to nucleoside analogs. To test the stability of the ExoN(-) genotype and phenotype, we passaged MHV-ExoN(-) 250 times in cultured cells (P250), in parallel with WT-MHV. Compared to MHV-ExoN(-) P3, MHV-ExoN(-) P250 demonstrated enhanced replication, reduced susceptibility to nucleoside analogs, and increased competitive fitness. However, passage did not select for complete or partial reversion at the ExoN-inactivating mutations. We identified novel amino acid changes within the RNA-dependent RNA polymerase (nsp12-RdRp) and nsp14 of MHV-ExoN(-) P250 that partially account for the observed changes in replication, susceptibility to nucleoside analogs, and competitive fitness observed in the passaged virus population, indicating that additional determinants can compensate for the activities of nsp14-ExoN. Our results suggest that while selection favors restoration of replication fidelity in ExoN(-) CoVs, there may be a significant barrier to ExoN(-) reversion. These results also support the hypothesis that high-fidelity replication is linked to CoV fitness and identify additional candidate proteins that may regulate CoV replication fidelity.IMPORTANCEUnique among RNA viruses, CoVs encode a proofreading exoribonuclease (ExoN) in nsp14 that mediates high-fidelity RNA genome replication. Proofreading-deficient CoVs with disrupted ExoN activity [ExoN(-)] are either non-viable or have significant defects in replication, RNA synthesis, fidelity, fitness, and virulence. In this study, we show that ExoN(-) murine hepatitis virus can adapt over long-term passage for increased replication and fitness without reverting the ExoN-inactivating mutations. Passage-adapted ExoN(-) mutants also demonstrate increasing resistance to nucleoside analogs that is only partially explained by secondary mutations in nsp12 and nsp14. These data suggest that enhanced resistance to nucleoside analogs is mediated by the interplay of multiple replicase proteins and support the proposed link between CoV fidelity and fitness.",2017-08-11,Kevin W. Graepel; Xiaotao Lu; James Brett Case; Nicole R. Sexton; Everett Clinton Smith; Mark R. Denison,,,,True,biorxiv_medrxiv,https://doi.org/10.1101/175562
pgfdy23h,7116ddab89281e7641fb659019c90ee3715f5039,biorxiv,The impact of persistent bacterial bronchitis on the pulmonary microbiome of children,10.1101/181982,,,biorxiv,"AbstractPersistent bacterial bronchitis is a leading cause of chronic wet cough in young children. This study aimed to characterise the respiratory bacterial microbiota of healthy children and to assess the impact of the changes associated with the development of persistent bacterial bronchitis.Blind, protected brushings were obtained from 20 healthy controls and 24 children with persistent bacterial bronchitis, with an additional directed sample obtained from persistent bacterial bronchitis patients. DNA was extracted, quantified using a 16S rRNA gene quantitative PCR assay prior to microbial community analysis by 16S rRNA gene sequencing.No significant difference in bacterial diversity or community composition (R2 = 0.01, P = 0.36) was observed between paired blind and non-blind brushes, showing that blind brushings are a valid means of accessing the airway microbiota. This has important implications for collecting lower respiratory samples from healthy children. A significant decrease in bacterial diversity (P < 0.001) and change in community composition (R2 = 0.08, P = 0.004) was observed between controls and patients. Bacterial communities within patients with PBB were dominated by Proteobacteria, and indicator species analysis showed that Haemophilus and Neisseria were significantly associated with the patient group. In 15 (52.9%) cases the dominant organism by sequencing was not identified by standard routine clinical culture.The bacteria present in the lungs of patients with persistent bacterial bronchitis were less diverse in terms of richness and evenness. The results validate the clinical diagnosis, and suggest that more attention to bacterial communities in children with chronic cough may lead to more rapid recognition of this condition with earlier treatment and reduction in disease burden.",2017-08-29,Leah Cuthbertson; Vanessa Craven; Lynne Bingle; William O.C.M. Cookson; Mark L. Everard; Miriam F. Moffatt,,,,True,biorxiv_medrxiv,https://doi.org/10.1101/181982
p3b4yk5d,3d690de86ca6e200f4f9cac61b004e47ad753aae,biorxiv,Mouse hepatitis virus nsp14 exoribonuclease activity is required for resistance to innate immunity,10.1101/182196,,,biorxiv,"ABSTRACTCoronaviruses (CoV) are positive-sense RNA viruses that infect numerous mammalian and avian species and are capable of causing severe and lethal disease in humans. CoVs encode several innate immune antagonists that interact with the host innate immune response to facilitate efficient viral replication. CoV non-structural protein 14 (nsp14) encodes 3'-to-5' exoribonuclease activity (ExoN), which performs a proofreading function and is required for high-fidelity replication. Outside of the order Nidovirales, arenaviruses are the only RNA viruses that encode an ExoN, which functions to degrade dsRNA replication intermediates. In this study, we tested the hypothesis that CoV ExoN may also function to antagonize the innate immune response. We demonstrate that viruses lacking ExoN activity [ExoN(-)] are sensitive to cellular pretreatment with interferon beta (IFN-β) in a dose-dependent manner. In addition, ExoN(-) virus replication was attenuated in wild-type bone marrow-derived macrophages (BMMs) and partially restored in interferon alpha/beta receptor deficient (IFNAR-/-) BMMs. ExoN(-) virus replication did not result in IFN-β gene expression, and in the presence of an IFN-β-mediated antiviral state, ExoN(-) viral RNA levels were not substantially reduced relative to untreated. However, ExoN(-) virus generated from IFN-β pretreated cells had reduced specific infectivity and decreased relative fitness, suggesting that ExoN(-) virus generated during an antiviral state is less viable to establish a subsequent infection. Overall, our data suggest MHV ExoN activity is required for resistance to the innate immune response and antiviral mechanisms affecting the viral RNA sequence and/or an RNA modification act on viruses lacking ExoN activity.",2017-08-29,James Brett Case; Yize Li; Ruth Elliott; Xiaotao Lu; Kevin W. Graepel; Nicole R. Sexton; Everett Clinton Smith; Susan R. Weiss; Mark R. Denison,,,,True,biorxiv_medrxiv,https://doi.org/10.1101/182196
g55d5ijx,08a22278486e12768ce186677a6a89663d24586f,biorxiv,Complemented palindrome small RNAs first discovered from SARS coronavirus,10.1101/185876,,,biorxiv,"AbstractIn this study, we reported for the first time the existence of complemented palindrome small RNAs (cpsRNAs) and proposed cpsRNAs and palindrome small RNAs (psRNAs) as a novel class of small RNAs. The first discovered cpsRNA UCUUUAACAAGCUUGUUAAAGA from SARS coronavirus named SARS-CoV-cpsR-22 contained 22 nucleotides perfectly matching its reverse complementary sequence. Further sequence analysis supported that SARS-CoV-cpsR-22 originated from bat betacoronavirus. The results of RNAi experiments showed that one 19-nt segment of SARS-CoV-cpsR-22 significantly induced cell apoptosis. These results suggested that SARS-CoV-cpsR-22 could play a role in SARS-CoV infection or pathogenicity. The discovery of psRNAs and cpsRNAs paved the way to find new markers for pathogen detection and reveal the mechanisms in the infection or pathogenicity from a different point of view. The discovery of psRNAs and cpsRNAs also broaden the understanding of palindrome motifs in animal of plant genomes.",2017-09-07,Chang Liu; Ze Chen; Wenyuan Shen; Deshui Yu; Siyu Li; Yue Hu; Haishuo Ji; Wenjun Bu; Qingsong Wang; Shan Gao,,,,True,biorxiv_medrxiv,https://doi.org/10.1101/185876
