vok1dni9,090b6c8b3df30bc248221869f673a2d970caa1b9,medrxiv,Quantifying the success of measles vaccination campaigns in the Rohingya refugee camps,10.1101/19008417,,,medrvix,"In the wake of the Rohingya population's mass migration from Myanmar, one of the world's largest refugee settlements was constructed in Cox's Bazar, Bangladesh to accommodate nearly 900,000 new refugees. Refugee populations are particularly vulnerable to infectious disease outbreaks due to many population and environmental factors. A large measles outbreak, with over 2,500 cases, occurred among the Rohingya population between September and December 2017. Here, we estimate key epidemiological parameters and use a dynamic mathematical model of measles transmission to evaluate the effectiveness of the reactive vaccination campaigns in the refugee camps. We also estimate the potential for subsequent outbreaks under different vaccination coverage scenarios. Our modeling results highlight the success of the vaccination campaigns in rapidly curbing transmission and emphasize the public health importance of maintaining high levels of vaccination in this population, where high birth rates and historically low vaccination coverage rates create suitable conditions for future measles outbreaks.",2019-10-05,Taylor Chin; Caroline O. Buckee; Ayesha S. Mahmud,,,,True,biorxiv_medrxiv,https://doi.org/10.1101/19008417
jwesa12u,10525ac89e46be4cb9cb9fd1131d28411a902047,medrxiv,Using Digital Surveillance Tools for Near Real-Time Mapping of the Risk of International Infectious Disease Spread: Ebola as a Case Study,10.1101/19011940,,,medrvix,"In our increasingly interconnected world, it is crucial to understand the risk of an outbreak originating in one country or region and spreading to the rest of the world. Digital disease surveillance tools such as ProMED and HealthMap have the potential to serve as important early warning systems as well as complement the field surveillance during an ongoing outbreak. Here we present a flexible statistical model that uses data produced from digital surveillance tools (ProMED and HealthMap) to forecast short term incidence trends in a spatially explicit manner. The model was applied to data collected by ProMED and HealthMap during the 2013-2016 West African Ebola epidemic. The model was able to predict each instance of international spread 1 to 4 weeks in advance. Our study highlights the potential and limitations of using publicly available digital surveillance data for assessing outbreak dynamics in real-time.",2019-11-15,Sangeeta Bhatia; Britta Lassmann; Emily Cohn; Malwina Carrion; Moritz U.G. Kraemer; Mark Herringer; John Brownstein; Larry Madoff; Anne Cori; Pierre Nouvellet,,,,True,biorxiv_medrxiv,https://doi.org/10.1101/19011940
npd2qf7m,44b6eea3629b4e13595dc49813ee39a0d20dc5f2,biorxiv,Evolutionary rate shifts suggest species-specific adaptation events in HIV-1 and SIV,10.1101/190769,,,biorxiv,"AbstractThe process of molecular adaptation following a cross-species virus transmission event is currently poorly understood. Here, we identified 137 protein sites that experienced deceleration in their rate of evolution along the HIV-1/SIV phylogeny, likely indicating gain-of-function and consequent adaptation. The majority of such events occurred in parallel to cross-species transmission events and varied between HIV-1 groups, indicating independent adaptation strategies. The evolutionary rate decelerations we found were particularly prominent in accessory proteins that counteract host antiviral restriction factors, suggesting that these factors are a major barrier to viral adaptation to a new host. Surprisingly, we observed that the non-pandemic HIV-1 group O, derived from gorillas, exhibited more rate deceleration events than the pandemic group M, derived from chimpanzees. We suggest that the species barrier is higher when the genetic distance of the hosts increases. Our approach paves the way for subsequent studies on cross-species transfers in other major pathogens.",2017-09-19,Maoz Gelbart; Adi Stern,,,,True,biorxiv_medrxiv,https://doi.org/10.1101/190769
6riyqn4k,aa5a99e67d3e887b3fa88575fb0d4a662d0a60ce,biorxiv,Modeling Epidemics: A Primer and Numerus Software Implementation,10.1101/191601,,,biorxiv,"AbstractEpidemiological models are dominated by SEIR (Susceptible, Exposed, Infected and Removed) dynamical systems formulations and their elaborations. These formulations can be continuous or discrete, deterministic or stochastic, or spatially homogeneous or heterogeneous, the latter often embracing a network formulation. Here we review the continuous and discrete deterministic and discrete stochastic formulations of the SEIR dynamical systems models, and we outline how they can be easily and rapidly constructed using the Numerus Model Builder, a graphically-driven coding platform. We also demonstrate how to extend these models to a metapopulation setting using both the Numerus Model Builder network and geographical mapping tools.",2017-09-22,Wayne M. Getz; Richard Salter; Oliver Muellerklein; Hyun S. Yoon; Krti Tallam,,,,True,biorxiv_medrxiv,https://doi.org/10.1101/191601
uw76y16g,9b17a9fa6be11d8b3dbed9f3dea2516020083bd3,biorxiv,Fast Virome Explorer: A Pipeline for Virus and Phage Identification and Abundance Profiling in Metagenomics Data,10.1101/196998,,,biorxiv,"AbstractIdentifying viruses and phages in a metagenomics sample has important implication in improving human health, preventing viral outbreaks, and developing personalized medicine. With the rapid increase in data files generated by next generation sequencing, existing tools for identifying and annotating viruses and phages in metagenomics samples suffer from expensive running time. In this paper, we developed a stand-alone pipeline, FastViromeExplorer, for rapid identification and abundance quantification of viruses and phages in big metagenomic data. Both real and simulated data validated FastViromeExplorer as a reliable tool to accurately identify viruses and their abundances in large data, as well as in a time efficient manner.",2017-10-02,Saima Sultana Tithi; Roderick V. Jensen; Liqing Zhang,,,,True,biorxiv_medrxiv,https://doi.org/10.1101/196998
ifla4aix,7395de48b2402e5e1561a93b99e8aae8728c6ff1,biorxiv,RNA-binding activity of TRIM25 is mediated by its PRY/SPRY domain and is required for ubiquitination,10.1101/200410,,,biorxiv,"ABSTRACTTRIM25 is a novel RNA-binding protein and a member of the Tripartite Motif (TRIM) family of E3 ubiquitin ligases, which plays a pivotal role in the innate immune response. Almost nothing is known about its RNA-related roles in cell biology. Furthermore, its RNA-binding domain has not been characterized. Here, we reveal that RNA-binding activity of TRIM25 is mediated by its PRY/SPRY domain, which we postulate to be a novel RNA-binding domain. Using CLIP-seq and SILAC-based co-immunoprecipitation assays, we uncover TRIM25’s endogenous RNA targets and protein binding partners. Finally, we show that the RNA-binding activity of TRIM25 is important for its ubiquitin ligase function. These results reveal new insights into the molecular roles and characteristics of RNA-binding E3 ubiquitin ligases and demonstrate that RNA could be an essential factor for their biological functions.",2017-10-09,Nila Roy Choudhury; Gregory Heikel; Maryia Trubitsyna; Peter Kubik; Jakub Stanislaw Nowak; Shaun Webb; Sander Granneman; Christos Spanos; Juri Rappsilber; Alfredo Castello; Gracjan Michlewski,,,,True,biorxiv_medrxiv,https://doi.org/10.1101/200410
v4spn75m,,biorxiv,IFITM proteins inhibit HIV-1 protein synthesis,10.1101/201525,,,biorxiv,"AbstractInterferon induced transmembrane proteins (IFITMs) inhibit the cellular entry of a broad range of viruses, but it has been suspected that for HIV-1 IFITMs may also inhibit a post-integration replicative step. We show that IFITM expression reduces HIV-1 viral protein synthesis by preferentially excluding viral mRNA transcripts from translation and thereby restricts viral production. Codon-optimization of proviral DNA rescues viral translation, implying that IFITM-mediated restriction requires recognition of viral RNA elements. In addition, we find that expression of the viral accessory protein Nef can help overcome the IFITM-mediated inhibition of virus production. Our studies identify a novel role for IFITMs in inhibiting HIV replication at the level of translation, but show that the effects can be overcome by the lentiviral protein Nef.",2017-10-11,Wing-Yiu Jason Lee; Chen Liang; Richard D Sloan,,,,False,biorxiv_medrxiv,https://doi.org/10.1101/201525
43cxzudl,,biorxiv,Delving Below the Species Level To Characterize the Ecological Diversity within the Global Virome: An Exploration of West Nile Virus,10.1101/2019.12.12.874214,,,biorxiv,"SummaryEfforts to describe the diversity of viruses have largely focused on classifying viruses at the species level. However, substantial ecological diversity, both in virulence level and host range, is known within virus species. Here we demonstrate a proof of concept for easily discovering ecological diversity within a virus species taxon. We have focused on the West Nile Virus to take advantage of its broad host range in nature. We produced a genome-based phylogeny of world diversity of WNV and then used Ecotype Simulation 2 to hypothesize demarcation of genomes into 69 putative ecotypes (ecologically distinct populations), based only on clustering of genome sequences. Then we looked for evidence of ecological divergence among ecotypes based on differences in host bird associations within the Connecticut-New York region. Our results indicated significant heterogeneity among ecotypes for their associations with different bird hosts. Ecological diversity within other zoonotic viruses could be easily discovered using this approach. Opportunities for extending this line of research to human associations of virus ecotypes are limited by missing geographic metadata on human samples.",2019-12-13,Tong Kong; Kelly Mei; Ammie Wang; Danny Krizanc; Frederick M. Cohan,,,,False,biorxiv_medrxiv,https://doi.org/10.1101/2019.12.12.874214
2fcl6f4i,97027e08cb413795cf19064338efd049fe5d491b,biorxiv,Novel splicing and open reading frames revealed by long-read direct RNA sequencing of adenovirus transcripts,10.1101/2019.12.13.876037,,,biorxiv,"AbstractAdenovirus is a common human pathogen that relies on host cell processes for production and processing of viral RNA. Although adenoviral promoters, splice junctions, and cleavage and polyadenylation sites have been characterized using low-throughput biochemical techniques or short read cDNA-based sequencing, these technologies do not fully capture the complexity of the adenoviral transcriptome. By combining Illumina short-read and nanopore long-read direct RNA sequencing approaches, we mapped transcription start sites and cleavage and polyadenylation sites across the adenovirus genome. The canonical viral early and late RNA cassettes were confirmed, but analysis of splice junctions within long RNA reads revealed an additional 20 novel viral transcripts. These RNAs include seven new splice junctions which lead to expression of canonical open reading frames (ORF), as well as 13 transcripts encoding for messages that potentially alter protein functions through truncations or the fusion of canonical ORFs. In addition, we also detect RNAs that bypass canonical cleavage sites and generate potential chimeric proteins by linking separate gene transcription units. Our work highlights how long-read sequencing technologies can reveal further complexity within viral transcriptomes.",2019-12-13,Alexander M. Price; Katharina E. Hayer; Daniel P. Depledge; Angus C. Wilson; Matthew D. Weitzman,,,,True,biorxiv_medrxiv,https://doi.org/10.1101/2019.12.13.876037
bqwmx5dy,93f67ffe7803061de9b19c4dfa346b3aa97aa4eb,biorxiv,Non-uniform refinement: Adaptive regularization improves single particle cryo-EM reconstruction,10.1101/2019.12.15.877092,,,biorxiv,"AbstractSingle particle cryo-EM is a powerful method for studying proteins and other biological macromolecules. Many of these molecules comprise regions with varying structural properties including disorder, flexibility, and partial occupancy. These traits make computational 3D reconstruction from 2D images challenging. Detergent micelles and lipid nanodiscs, used to keep membrane proteins in solution, are common examples of locally disordered structures that can negatively affect existing iterative refinement algorithms which assume rigidity (or spatial uniformity). We introduce a cross-validation approach to derive non-uniform refinement, an algorithm that automatically regularizes 3D density maps during iterative refinement to account for spatial variability, yielding dramatically improved resolution and 3D map quality. We find that in common iterative refinement methods, regularization using spatially uniform filtering operations can simultaneously over- and under-regularize local regions of a 3D map. In contrast, non-uniform refinement removes noise in disordered regions while retaining signal useful for aligning particle images. Our results include state-of-the-art resolution 3D reconstructions of multiple membrane proteins with molecular weight as low as 90kDa. These results demonstrate that higher resolutions and improved 3D density map quality can be achieved even for small membrane proteins, an important use case for single particle cryo-EM, both in structural biology and drug discovery. Non-uniform refinement is implemented in the cryoSPARC software package and has already been used successfully in several notable structural studies.",2019-12-16,Ali Punjani; Haowei Zhang; David J. Fleet,,,,True,biorxiv_medrxiv,https://doi.org/10.1101/2019.12.15.877092
eohjkqc4,,biorxiv,"Randomly primed, strand-switching MinION-based sequencing for the detection and characterization of cultured RNA viruses",10.1101/2019.12.16.875872,,,biorxiv,"AbstractRNA viruses rapidly mutate, which can result in increased virulence, increased escape from vaccine protection, and false negative detection results. Targeted detection methods have a limited ability to detect unknown viruses and often provide insufficient data to detect coinfections or identify antigenic variants. Random, deep sequencing is a method that can more fully detect and characterize RNA viruses and is often coupled with molecular techniques or culture methods for viral enrichment. Viral culture coupled with third-generation sequencing were tested for the ability to detect and characterize RNA viruses. Cultures of bovine viral diarrhea virus, canine distemper virus, epizootic hemorrhagic disease virus, infectious bronchitis virus, two influenza A viruses, and porcine respiratory and reproductive syndrome virus were sequenced on the MinION platform using a random, reverse primer in a strand-switching reaction, coupled with PCR-based barcoding. Reads were taxonomically classified and used for reference-based sequence building using a stock personal computer. This method accurately detected and identified complete coding sequence genomes with a minimum of 20× coverage depth for all seven viruses, including a sample containing two viruses. Each lineage-typing region had at least 26× coverage depth for all viruses. Furthermore, analyzing the canine distemper virus sample through a pipeline devoid of canine distemper virus reference sequences modeled the ability of this protocol to detect unknown viruses. These results show the ability of this technique to detect and characterize dsRNA, negative- and positive-sense ssRNA, nonsegmented, and segmented RNA viruses.",2019-12-16,Kelsey T. Young; Kevin K. Lahmers; Holly S. Sellers; David E. Stallknecht; Rebecca L. Poulson; Jerry T. Saliki; S. Mark Tompkins; Ian Padykula; Chris Siepker; Elizabeth W. Howerth; Michelle Todd; James B. Stanton,,,,False,biorxiv_medrxiv,https://doi.org/10.1101/2019.12.16.875872
t2azgyp8,b0899a264af548a89d649154aec569889717b295,medrxiv,Stochastic challenges to interrupting helminth transmission,10.1101/2019.12.17.19013490,,,medrvix,"Predicting the effect of different programmes designed to control both the morbidity induced by helminth infections and parasite transmission is greatly facilitated by the use of mathematical models of transmission and control impact. In such models, it is essential to account for as many sources of uncertainty -- natural, or otherwise -- to ensure robustness in prediction and to accurately depict variation around an expected outcome. In this paper, we investigate how well the standard deterministic models match the predictions made using individual-based stochastic simulations. We also explore how well concepts which derive from deterministic models, such as ‘breakpoints’ in transmission, apply in the stochastic world. Employing an individual based stochastic model framework we also investigate how transmission and control are affected by the migration of infected people into a defined community. To give our study focus we consider the control of soil-transmitted helminths (STH) by mass drug administration (MDA), though our methodology is readily applicable to the other helminth species such as the schistosome parasites and the filarial worms. We show it is possible to define a ‘stochastic breakpoint’ where much noise surrounds the expected deterministic breakpoint. We also discuss the concept of the ‘interruption of transmission’ independent of the ‘breakpoint’ concept where analyses of model behaviour illustrate the current limitations of deterministic models to account for the ‘fade-out’ or transmission extinction behaviour in simulations. The analyses based on migration confirm a relationship between the infected human migration rate per unit of time and the death rate of infective stages that are released into the free-living environment (eggs or larvae depending on the STH species) that create the reservoir of infection which in turn determines the likelihood that control activities aim at chemotherapeutic treatment of the human host will eliminate transmission. The development of a new stochastic simulation code for STH in the form of a publicly-available open-source python package which includes features to incorporate many population stratifications, different control interventions including mass drug administration (with defined frequency, coverage levels and compliance patterns) and inter-village human migration is also described.",2019-12-18,Robert J Hardwick; Marleen Werkman; James E Truscott; Roy M Anderson,,,,True,biorxiv_medrxiv,https://doi.org/10.1101/2019.12.17.19013490
bi49e7ne,a555fbeeffc44dfdb5087c83395f0f743654cbba,biorxiv,A novel totivirus alters gene expression and vacuolar morphology in Malassezia cells and induces a TLR3-mediated inflammatory immune response,10.1101/2019.12.17.880526,,,biorxiv,"AbstractMost fungal viruses have been identified in plant pathogens, whereas the presence of viral particles in human pathogenic fungi is less well studied. In the present study, we observed extrachromosomal double-stranded RNA (dsRNA) segments in various clinical isolates of Malassezia species. Malassezia is the most dominant fungal genus on the human skin surface, and species in this group are considered to be etiological factors in various skin diseases including dandruff, seborrheic dermatitis, and atopic dermatitis. We identified novel dsRNA segments and our sequencing results revealed that the virus, named MrV40, belongs to the Totiviridae family and contains an additional satellite dsRNA segment encoding a novel protein. The transcriptome of virus-infected M. restricta cells was compared to that of virus-free cells, and the results showed that transcripts involved in ribosomal biosynthesis were down regulated and those involved in energy production and programmed cell death were increased in abundance. Moreover, transmission electron microscopy revealed significantly larger vacuoles for virus-infected M. restricta cells, indicating that MrV40 infection dramatically altered M. restricta physiology. Our analysis also revealed that a viral nucleic acid from MrV40 induces a TLR3-mediated inflammatory immune response in bone marrow-derived dendritic cells (BMDCs) and this result suggests that a viral element contributes to the pathogenesis of Malassezia.ImportanceMalassezia is the most dominant fungal genus on the human skin surface and is associated with various skin diseases including dandruff and seborrheic dermatitis. Among Malassezia species, M. restricta is the most widely observed species on the human skin. In the current study, we identified a novel dsRNA virus, named MrV40, in M. restricta and characterized the sequences and structure of the viral genome along with an independent satellite dsRNA viral segment. Moreover, we found altered expression of genes involved in ribosomal synthesis and programmed cell death, indicating that virus infection altered the physiology of the fungal host cells. Our data also showed that the viral nucleic acid from MrV40 induces a TLR3-mediated inflammatory immune response in bone marrow-derived dendritic cells (BMDCs), indicating that a viral element likely contributes to the pathogenesis of Malassezia. This is the first study to identify and characterize a novel mycovirus in Malassezia.",2019-12-19,Minji Park; Yong-Joon Cho; Donggyu Kim; Chul-Su Yang; Shi Mun Lee; Thomas L. Dawson; Satoshi Nakamizo; Kenji Kabashima; Yang Won Lee; Won Hee Jung,,,,True,biorxiv_medrxiv,https://doi.org/10.1101/2019.12.17.880526
e5p4metz,8c223fd63ba6a924ecd3df8d32bcf0556758cb95,biorxiv,"Nanopore-based native RNA sequencing provides insights into prokaryotic transcription, operon structures, rRNA maturation and modifications",10.1101/2019.12.18.880849,,,biorxiv,"AbstractThe prokaryotic transcriptome is shaped by transcriptional and posttranscriptional events that define the characteristics of an RNA, including transcript boundaries, the base modification status, and processing pathways to yield mature RNAs. Currently, a combination of several specialised short-read sequencing approaches and additional biochemical experiments are required to describe all transcriptomic features. In this study, we present native RNA sequencing of bacterial (E. coli) and archaeal (H. volcanii, P. furiosus) transcriptomes employing the Oxford Nanopore sequencing technology. Based on this approach, we could address multiple transcriptomic characteristics simultaneously with single-molecule resolution. Taking advantage of long RNA reads provided by the Nanopore platform, we could accurately (re-)annotate large transcriptional units and boundaries. Our analysis of transcription termination sites revealed that diverse termination mechanisms are in place in archaea. Moreover, we shed light on the poorly understood rRNA processing pathway in archaea and detected new processing intermediates. One of the key features of native RNA sequencing is that RNA modifications are retained. We could confirm this ability by analysing the well-known KsgA-dependent rRNA methylation sites. Notably, our analysis suggests that rRNA modifications are more abundant in a hyperthermophilic organism.",2019-12-19,Felix Grünberger; Robert Knüppel; Michael Jüttner; Martin Fenk; Andreas Borst; Robert Reichelt; Winfried Hausner; Jörg Soppa; Sebastien Ferreira-Cerca; Dina Grohmann,,,,True,biorxiv_medrxiv,https://doi.org/10.1101/2019.12.18.880849
qw2tsrxm,73d80c8f5780d70bd8d343188c56e898e91557b6,biorxiv,Ca2+ ions promote fusion of Middle East Respiratory Syndrome coronavirus with host cells and increase infectivity,10.1101/2019.12.18.881391,,,biorxiv,"AbstractMiddle East respiratory syndrome coronavirus (MERS-CoV) is a major emerging zoonotic infectious disease. Since its first outbreak in 2012, the virus has repeatedly transmitted from camels to humans with 2,468 confirmed cases, causing 851 deaths. To date, there are no efficacious drugs and vaccines against MERS-CoV, increasing its potential to cause a public health emergency. A critical step in the life cycle of MERS-CoV is the fusion with the host cell with its spike (S) protein as main determinant of viral entry. Proteolytic cleavage of S exposes its fusion peptide (FP), which initiates membrane fusion. Previous studies on the related severe acute respiratory syndrome coronavirus (SARS-CoV) FP have shown that calcium (Ca2+) plays an important role for fusogenic activity via a Ca2+ binding pocket with conserved glutamic acid (E) and aspartic acid (D) residues. SARS-CoV and MERS-CoV FP share a high sequence homology and here, we investigated whether Ca2+ is required for MERS-CoV fusion by substituting E and D residues in the MERS-CoV FP with neutrally charged alanines. Upon verifying mutant cell surface expression and proteolytic cleavage, we tested the mutants ability to mediate infection of pseudo-particles (PPs) on host cells without and with Ca2+. Our results demonstrate that intracellular Ca2+ enhances MERS-CoV WT PPs infection by approximately two-fold and that E891 is a crucial residue for Ca2+ interaction. Electron spin resonance revealed that this enhancement could be attributed to Ca2+ increasing MERS-CoV FP fusion-relevant membrane ordering. Intriguingly, isothermal calorimetry titration showed that MERS-CoV FP binds one Ca2+, as opposed to SARS-CoV FP which binds two. Our data suggests that there are significant differences in FP-Ca2+ interactions of MERS-CoV and SARS-CoV FP despite their high sequence similarity and that the number of Ca2+ ions interacting with the FP has implications on the fusion dynamics of the virus.",2019-12-19,Marco R. Straus; Tiffany Tang; Alex L. Lai; Annkatrin Flegel; Miya Bidon; Jack H. Freed; Susan Daniel; Gary R. Whittaker,,,,True,biorxiv_medrxiv,https://doi.org/10.1101/2019.12.18.881391
